{
  "schema_version": "1.0",
  "event_id": "c7e1d0a4-0005-4f2b-9a6e-5b3c2d1e0f01",
  "event_type": "skip",
  "user_id": "3b6f1a2c-5d4e-4f7a-9b8c-1d2e3f4a5b6c",
  "device_id": "android-7f3a9c21",
  "track_id": "3PcIfTefcjfWTK6WFmOLqK",
  "session_id": "b2c3d4e5-f6a7-4b8c-9d0e-1f2a3b4c5d6e",
  "device_ts": "2026-09-30T23:10:20.000Z",
  "server_ts": "2026-10-02T08:00:03.500Z",
  "position_ms": 20000,
  "country_playback": "CO",
  "is_offline": true
}
